Cluster_ID,Date,Title,Title_EN,Description,Description_EN,Type,Location_Name,Lat,Lon,Actor,Reliability,Verification_Status,Source_Names,Source_Links
f2268305-66bf-420f-af6b-2c1575cf887d,2025-12-23 00:56:24,Attacco di Droni e Bombardieri Russi Contro l'Ucraina,Russian Drone and Bomber Strike Targets Ukraine,"Il 23 dicembre 2025, le forze russe hanno avviato un attacco coordinato con droni Geran-2 e bombardieri Tu-95MS mirato a interrompere lo spazio aereo e le operazioni militari ucraine. Circa 75 droni sono stati rilevati nello spazio aereo ucraino. La Flotta del Mar Nero non ha mostrato nuova attività, ma due corvette Buyan-M equipaggiate con missili Kalibr sono stazionate presso la base navale di Kaspiysk. Non sono state registrate partenze dalle basi aeree di Engels-2 o Olenya.","On December 23, 2025, Russian forces initiated a coordinated strike involving Geran-2 drones and Tu-95MS bombers aimed at disrupting Ukrainian airspace and military operations. Approximately 75 drones have been detected in Ukrainian airspace. The Black Sea Fleet has not shown new activity, but two Buyan-M corvettes equipped with Kalibr missiles are stationed at the Kaspiysk naval base. No departures have been recorded from Engels-2 or Olenya airbases.",Coordinated drone and bomber strike aimed at disrupting Ukrainian airspace and military operations.,Ukraine,,,RUS,40,VERIFIED,parabellumcommunity,https://t.me/parabellumcommunity/335787
9f7b8c04-2e0f-45e5-bee0-1729bfdbde61,2025-12-22 18:58:58,Le Forze Russe Lanciano un Assalto sull'Asse di Dobropillia,Russian Forces Launch Assault on Dobropillia Axis,"Questa mattina, le forze russe hanno avviato un assalto meccanizzato con quattro colonne corazzate sull'asse di Dobropillia. Il 1° Corpo Azov dell'Ucraina, il Gruppo di Lasar e l'SBS hanno risposto decisivamente, distruggendo 6 carri armati, 9 veicoli da combattimento di fanteria, 5 veicoli blindati per il trasporto di truppe, un veicolo di recupero e 10 unità motorizzate. Le perdite nemiche in termini di personale sono ancora in fase di valutazione.","This morning, Russian forces initiated a mechanized assault with four armored columns on the Dobropillia axis. The Ukrainian 1st Azov Corps, Lasar Group, and SBS responded decisively, destroying 6 tanks, 9 infantry fighting vehicles, 5 armored personnel carriers, a recovery vehicle, and 10 motorized units. Enemy personnel losses are still being assessed.","Mechanized assault to gain ground on the Dobropillia axis, repelled by Ukrainian defensive operations.",Dobropillia,,,RUS,40,VERIFIED,parabellumcommunity,https://t.me/parabellumcommunity/335749
b1a0db05-b7ab-4eeb-9f47-7588957a48ee,2025-12-22 16:39:28,Le Forze Ucraine Eseguono Operazioni al Fronte di Pokrovsk,Ukrainian Forces Conduct Operations at Pokrovsk Front,"I soldati ucraini del 20° reggimento 'Lubart' del Corpo della Guardia Nazionale 'Azov' stanno conducendo operazioni difensive nell'area del fronte di Pokrovsk. Le loro attività si concentrano su Rodynske e nella regione della miniera Krasnolimanskaya, situata a nord di Pokrovsk.","Ukrainian soldiers from the 20th 'Lubart' regiment of the National Guard's 'Azov' Corps are conducting defensive operations in the Pokrovsk front area. Their activities are focused on Rodynske and the Krasnolimanskaya mine region, located north of Pokrovsk.",Defensive operations in Pokrovsk front,Rodynske,,,UKR,40,VERIFIED,parabellumcommunity,https://t.me/parabellumcommunity/335737
e4744c4f-4b56-4992-99c0-5e7237976aee,2025-12-22 13:57:44,Assassinii mirati di generali russi a Mosca,Targeted Assassinations of Russian Generals in Moscow,"A Mosca, tre generali russi di alto rango sono stati assassinati in un anno. Il generale Igor Kirilov è stato ucciso in un'esplosione di auto il 17 dicembre 2024. Il generale Jaroslav Moskalik è morto in un incidente simile il 25 aprile 2025. Recentemente, il generale Fanil Sarvarov è stato ucciso in un'esplosione di auto in Yasenevskaya Street questa mattina. Questi incidenti sembrano mirati a interrompere le strutture di comando militari.","In Moscow, three high-ranking Russian generals have been assassinated within a year. General Igor Kirilov was killed in a car explosion on December 17, 2024. General Jaroslav Moskalik died in a similar incident on April 25, 2025. Most recently, General Fanil Sarvarov was killed in a car explosion on Yasenevskaya Street this morning. These incidents appear aimed at disrupting military command structures.","Targeted assassinations of high-ranking Russian military officials, likely aimed at disrupting command structures.",Moscow,,,UNK,40,VERIFIED,parabellumcommunity,https://t.me/parabellumcommunity/335723
35eb8cb1-fa83-4efc-983a-b4da7e836b12,2025-12-22 12:55:32,I droni russi colpiscono il terminal Tamanneftegaz in Krasnodar,Russian Drones Strike Tamanneftegaz Terminal in Krasnodar,"I droni FP-1 russi hanno preso di mira il terminal petrolifero marittimo Tamanneftegaz nel Krasnodar Krai il 22 dicembre 2025. L'attacco ha causato danni alle attrezzature di carico, al molo per i gas idrocarburici liquefatti e ad altre infrastrutture portuali.","Russian FP-1 drones targeted the Tamanneftegaz maritime oil terminal in Krasnodar Krai on December 22, 2025. The attack resulted in damage to loading equipment, the liquefied hydrocarbon gas dock, and other port infrastructure.",Disrupting logistics and energy infrastructure,Krasnodar Krai,,,RUS,40,VERIFIED,parabellumcommunity,https://t.me/parabellumcommunity/335719
997ed26d-2032-4e25-8d31-9fc8d0d49dd6,2025-12-22 12:40:56,La Russia Aumenta le Esportazioni di GNL in Cina,Russia Increases LNG Exports to China,"A novembre, le esportazioni di gas naturale liquefatto (GNL) della Russia in Cina hanno raggiunto un record di 1,6 milioni di tonnellate metriche, più del doppio rispetto all'anno precedente. Questo aumento si verifica mentre gli acquirenti ignorano le sanzioni occidentali per accedere a carburante più economico. La Russia mira a compensare il calo delle spedizioni in Europa, il suo mercato più grande per decenni prima dell'invasione dell'Ucraina, abbassando i prezzi per migliorare la competitività.","In November, Russia's liquefied natural gas (LNG) exports to China reached a record 1.6 million metric tons, more than doubling from the previous year. This increase comes as buyers overlook Western sanctions to access cheaper fuel. Russia aims to offset declining shipments to Europe, its largest market for decades prior to the Ukraine invasion, by lowering prices to enhance competitiveness.",Economic strategy to offset European sanctions,China,,,UNK,40,VERIFIED,parabellumcommunity,https://t.me/parabellumcommunity/335717
2151d4ae-b8d3-4ff4-968d-803877d3c051,2025-12-22 11:10:54,M1 Abrams ucraino abbandonato e colpito da droni,Ukrainian M1 Abrams Abandoned and Struck by Drones,"Un carro armato M1 Abrams ucraino abbandonato è stato colpito da droni FPV. Fonti russe affermano che fosse fornito dall'Australia, ma non ci sono prove a sostegno di questa affermazione. L'incidente è stato documentato in una fonte video.","An abandoned Ukrainian M1 Abrams tank has been reportedly hit by FPV drones. Russian sources claim it was supplied by Australia, but there is no evidence to support this assertion. The incident was documented in a video source.",Logistics,,,,RUS,40,VERIFIED,parabellumcommunity,https://t.me/parabellumcommunity/335708
