Cluster_ID,Date,Title,Title_EN,Description,Description_EN,Type,Location_Name,Lat,Lon,Actor,Reliability,Verification_Status,Source_Names,Source_Links
920e7f1c-cf7b-4bc5-949b-05e6a51f6e84,2025-12-22 22:39:33,Aerei Tu-160 e Tu-95MS in Volo,Tu-160 and Tu-95MS Aircraft Deploy in Air,"Il 22 dicembre 2025, due aerei Tu-160 sono stati osservati in volo dall'aeroporto di Ukrainka, mentre due aerei Tu-95MS sono stati confermati in volo dall'aeroporto di Belaya. Questo dispiegamento indica potenziali operazioni aeree.","On December 22, 2025, two Tu-160 aircraft were observed in the air from Ukrainka airfield, while two Tu-95MS aircraft were confirmed airborne from Belaya airfield. This deployment indicates potential air operations.",Strategic bomber deployment for potential air operations.,Ukrainka and Belaya,,,RUS,40,VERIFIED,MAKS23_NAFO,https://t.me/MAKS23_NAFO/77533
1472fbd5-b24d-4a2e-9a5c-52a91ba18cad,2025-12-22 22:17:58,I Pubblici Ministeri Indagano su Sorvolo di Droni a Ispra,Prosecutors Investigate Drone Overflights in Ispra,"I pubblici ministeri di Milano hanno concluso che 21 presunti sorvoli di droni russi sopra il Centro Comune di Ricerca Europeo a Ispra tra marzo e maggio 2025 erano causati da interferenze di un potenziatore di segnale GSM privato, non da attività reale di droni.","Milan prosecutors concluded that 21 reported overflights of Russian drones over the European Joint Research Centre in Ispra from March to May 2025 were caused by interference from a private GSM phone signal booster, not actual drone activity.",Debunking misinformation,Ispra,,,UNK,40,VERIFIED,MAKS23_NAFO,https://t.me/MAKS23_NAFO/77528
07f9161e-72d2-4432-a61e-331fde36b3ea,2025-12-22 21:56:23,Operazione GUR Distrugge Su-30 Russi Vicino a Lipetsk,GUR Operation Destroys Russian Su-30s Near Lipetsk,"Due caccia russi Su-30 sono stati distrutti durante un'operazione GUR in un aeroporto vicino a Lipetsk. Inoltre, il generale russo Fanil Sarvarov è stato ucciso in un'esplosione di una bomba su un'auto a Mosca. Il Giappone ha annunciato 6 miliardi di dollari di assistenza finanziaria all'Ucraina per il 2026, mentre l'UE ha esteso le sanzioni economiche contro la Russia fino a metà 2026. L'Ucraina ha anche ricevuto 2,3 miliardi di euro dall'UE e una centrale termica dalla Lituania.","Two Russian Su-30 fighter jets were destroyed during a GUR operation at an airfield near Lipetsk. Additionally, Russian Lieutenant General Fanil Sarvarov was killed in a car bomb explosion in Moscow. Japan announced $6 billion in financial assistance to Ukraine for 2026, while the EU extended economic sanctions against Russia until mid-2026. Ukraine also received 2.3 billion euros from the EU and a thermal power plant from Lithuania.",Disruption of Russian military logistics and infrastructure,"Krasnodar Krai, Donetsk region",,,UKR,40,VERIFIED,MAKS23_NAFO,https://t.me/MAKS23_NAFO/77524
4bd0056c-b163-4a23-be6a-419b6377e884,2025-12-22 21:34:38,Olexandr Shemet Muore Durante Operazione Militare ad Azovstal,Olexandr Shemet Dies During Military Operation in Azovstal,"Olexandr Shemet, comandante dell'equipaggio del Mi-24 della 12ª OBrAA, è morto il 17 dicembre 2025. È stato riconosciuto come Eroe dell'Ucraina per la sua partecipazione all'operazione di sfondamento militare recente ad Azovstal.","Olexandr Shemet, a Mi-24 crew commander from the 12th OBrAA, died on December 17, 2025. He was recognized as a Hero of Ukraine for his participation in the recent military breakthrough operation at Azovstal.",Military breakthrough operation,Azovstal,,,UKR,40,VERIFIED,MAKS23_NAFO,https://t.me/MAKS23_NAFO/77522
19e9eebc-8928-41e1-82d8-cf0375ea7795,2025-12-22 21:06:44,Il nemico attacca Odesa con UAV,Enemy Attacks Odesa with UAVs,"Il 22 dicembre 2025, le forze nemiche hanno attaccato Odesa utilizzando UAV d'attacco. L'attacco ha causato danni alle infrastrutture portuali e a un'imbarcazione civile, secondo Oleh Kiper, capo dell'OVA di Odesa.","On December 22, 2025, enemy forces attacked Odesa using strike UAVs. The attack resulted in damage to port infrastructure and a civilian vessel, according to Oleh Kiper, head of the Odesa OVA.",Logistics disruption,Odesa,,,RUS,40,VERIFIED,MAKS23_NAFO,https://t.me/MAKS23_NAFO/77519
c46d9f08-1a45-477f-bc58-39719715158f,2025-12-22 20:28:58,La Russia evacua le famiglie diplomatiche dal Venezuela,Russia Evacuates Diplomatic Families from Venezuela,"Il 22 dicembre 2025, la Russia ha iniziato a evacuare le famiglie dei suoi diplomatici dal Venezuela a causa di una situazione in deterioramento. Mosca valuta le circostanze in modo sempre più 'cupò'.","On December 22, 2025, Russia began evacuating the families of its diplomats from Venezuela due to a deteriorating situation. Moscow is increasingly assessing the circumstances as 'gloomy'.",Diplomatic evacuation due to deteriorating situation,Venezuela,,,UNK,40,VERIFIED,parabellumcommunity,https://t.me/parabellumcommunity/335755
f6d1cf27-7977-4f9f-8e64-372f03be274a,2025-12-22 19:50:51,Ucraina Disturba Affari Petroliferi Russi Durante Negoziazioni,Ukraine Disrupts Russian Oil Business Amid Negotiations,"Il Servizio di Sicurezza dell'Ucraina (SBU) sta pianificando attacchi alla flotta ombra russa e alle raffinerie di petrolio per minare l'economia russa. Questa strategia mira a ridurre i profitti per il presidente Putin e incoraggiare le negoziazioni. Rapporti recenti suggeriscono che l'ex presidente Trump potrebbe essere stato a conoscenza di queste operazioni, poiché l'Ucraina cerca di evitare tensioni con la Casa Bianca durante i colloqui di pace in corso.","The Security Service of Ukraine (SBU) is reportedly planning attacks on Russia's shadow fleet and oil refineries to undermine the Russian economy. This strategy aims to reduce profits for President Putin and encourage negotiations. Recent reports suggest that former President Trump may have been aware of these operations, as Ukraine seeks to avoid tensions with the White House during ongoing peace talks.",Disrupt Russian oil business to reduce Putin's profits and force negotiations.,,,,UKR,40,VERIFIED,MAKS23_NAFO,https://t.me/MAKS23_NAFO/77511
7547dceb-8992-4ba1-86c4-6213bb041e8a,2025-12-22 19:02:49,Le Forze Azov Respingeranno un Assalto Meccanizzato Vicino a Dobropillya,Azov Forces Repel Mechanized Assault Near Dobropillya,"Il 22 dicembre 2025, il 1° Corpo Azov e le unità adiacenti hanno respinto con successo un assalto meccanizzato delle forze di occupazione russe vicino a Dobropillya. L'attacco ha portato alla distruzione di 6 carri armati, 9 veicoli da combattimento della fanteria e 5 veicoli blindati per il trasporto di personale. L'ultima ondata ha coinvolto un assalto con ATV, con 10 su 11 veicoli motorizzati distrutti, lasciando solo uno a fuggire dal campo di battaglia.","On December 22, 2025, the 1st Corps of Azov and adjacent units successfully repelled a mechanized assault by Russian occupation forces near Dobropillya. The attack resulted in the destruction of 6 tanks, 9 infantry fighting vehicles, and 5 armored personnel carriers. The final wave involved an assault using ATVs, with 10 out of 11 motorized vehicles destroyed, leaving only one to escape the battlefield.",Attempted mechanized breakthrough with focus on vehicle-based assault,Dobropillya,,,RUS,40,VERIFIED,MAKS23_NAFO | noel_reports,https://t.me/MAKS23_NAFO/77507 | https://t.me/noel_reports/38901
d1957b3e-22f7-4736-9d07-0a6da63505ff,2025-12-22 18:02:07,La Russia Cattura Civili e Soldati a Hrabovske,Russia Captures Civilians and Soldiers in Hrabovske,"Il 22 dicembre 2025, il presidente ucraino Zelensky ha riferito che la Russia ha catturato civili e soldati a Hrabovske. Tra coloro che sono stati portati via c'erano bambini e 13 soldati ucraini. 52 civili hanno scelto di rimanere nel villaggio, avendo legami stretti con le forze russe. Le forze di difesa ucraine si sono astenute dall'attaccare a causa della presenza di questi civili.","On December 22, 2025, Ukrainian President Zelensky reported that Russia captured civilians and soldiers from Hrabovske. Among those taken were children and 13 Ukrainian servicemen. 52 civilians chose to remain in the village, having close ties with Russian forces. The Ukrainian defense forces refrained from attacking due to the presence of these civilians.",Population control/Intimidation,Hrabovske,,,RUS,40,VERIFIED,MAKS23_NAFO,https://t.me/MAKS23_NAFO/77501
a211c1c3-fd9c-42b6-bdbb-5bd516803367,2025-12-22 17:22:15,Nordic Air Defense Testa Intercettori Kreuger in Svezia,Nordic Air Defense Tests Kreuger Interceptors in Sweden,"Nordic Air Defense, un'azienda svedese, testerà i suoi nuovi intercettori Kreuger quest'inverno. Gli intercettori sono progettati per contrastare i UAV, in particolare i droni Shahed. Il Kreuger 100 è leggero e può essere lanciato da dispositivi portatili, raggiungendo velocità di 354 km/h e una portata di 3,2 km. Dopo i test, gli intercettori saranno inviati in Ucraina per prove operative.","Nordic Air Defense, a Swedish company, will test its new Kreuger interceptors this winter. The interceptors are designed to counter UAVs, specifically targeting Shahed drones. The Kreuger 100 is lightweight and can be launched from hand-held devices, reaching speeds of 354 km/h and a range of 3.2 km. Following testing, the interceptors will be deployed to Ukraine for operational trials.",Testing and deployment of new interceptor technology for operational trials against UAVs.,,,,UNK,40,VERIFIED,MAKS23_NAFO,https://t.me/MAKS23_NAFO/77492
daa55e25-693f-4cf4-93dd-fed93e38fb4f,2025-12-22 16:12:35,Zelensky Affronta la Prontezza Militare in Ucraina,Zelensky Addresses Military Readiness in Ukraine,"Il presidente ucraino Zelensky ha tenuto un incontro presso il quartier generale militare per discutere della difesa aerea e della prontezza militare. Ha sottolineato la necessità di una risposta forte se la Russia non si impegna seriamente nei negoziati. I rapporti includevano aggiornamenti su attacchi profondi e sulla fornitura di risorse per le Forze di Difesa, con particolare attenzione alla difesa aerea nella regione di Odesa.","Ukrainian President Zelensky held a military headquarters meeting to discuss air defense and military readiness. He emphasized the need for a strong response if Russia does not engage seriously in negotiations. Reports included updates on deep strikes and the provision of resources for the Defense Forces, particularly focusing on air defense in the Odesa region.",Strengthening air defense and military readiness,Odesa,,,UKR,40,VERIFIED,MAKS23_NAFO,https://t.me/MAKS23_NAFO/77483
d85dfe23-c00d-44b8-934d-a4061601c094,2025-12-22 16:04:23,Zelensky Affronta Preoccupazioni sulla Difesa Aerea in Ucraina,Zelensky Addresses Air Defense Concerns in Ukraine,"Il presidente ucraino Zelensky ha evidenziato la minaccia degli attacchi russi durante il Natale, sottolineando la necessità di un potenziamento della difesa aerea. Durante un recente incontro, ha osservato che l'attenzione era rivolta alla protezione di città, villaggi e comunità, in particolare il 23, 24 e 25 dicembre. Ha riconosciuto le difficoltà dovute a una carenza di risorse per la difesa aerea.","Ukrainian President Zelensky highlighted the threat of Russian attacks during Christmas, emphasizing the need for enhanced air defense. During a recent meeting, he noted that the focus was on protecting cities, villages, and communities, particularly on December 23rd, 24th, and 25th. He acknowledged the challenges posed by a shortage of air defense resources.",Terror bombing,,,,RU,40,VERIFIED,MAKS23_NAFO,https://t.me/MAKS23_NAFO/77481
8a19e7be-3e2f-47cf-87b4-b726aa703ccf,2025-12-22 14:57:58,Generale Sarvarov Ucciso a Mosca,General Sarvarov Killed in Moscow,"Il generale Sarvarov, capo del dipartimento di addestramento operativo delle Forze Armate russe, è stato ucciso oggi a Mosca. Ha svolto un ruolo cruciale nel collegare il personale generale con gli eserciti comandanti. Le sue responsabilità includevano la valutazione della prontezza dei comandanti e la supervisione dei piani operativi per le azioni militari nei prossimi mesi.","General Sarvarov, head of the operational training department of the Russian Armed Forces, was killed in Moscow today. He played a crucial role in linking the General Staff with commanding armies. His responsibilities included assessing the readiness of commanders and overseeing operational plans for military actions in the coming months.",Targeted elimination of a high-ranking military official,Moscow,,,UNK,40,VERIFIED,MAKS23_NAFO,https://t.me/MAKS23_NAFO/77475
150debff-e877-4ce5-b79b-e16987162a8b,2025-12-22 14:44:06,La Russia Sviluppa Arma Anti-Satellite Contro Starlink,Russia Develops Anti-Satellite Weapon Against Starlink,"I servizi di intelligence della NATO segnalano che la Russia sta creando una nuova arma anti-satellite mirata a interrompere la costellazione Starlink di Elon Musk. Questa arma, definita 'arma a effetto zona', è progettata per rilasciare pellet ad alta densità nelle orbite di Starlink, potenzialmente disabilitando più satelliti e rischiando danni collaterali ad altri sistemi. Lo sviluppo è visto come uno sforzo per contrastare la superiorità spaziale occidentale che ha supportato l'Ucraina nel suo conflitto.","NATO intelligence services report that Russia is creating a new anti-satellite weapon aimed at disrupting Elon Musk's Starlink constellation. This weapon, referred to as the 'zone-effect' weapon, is designed to release high-density pellets into Starlink orbits, potentially disabling multiple satellites and risking collateral damage to other systems. The development is seen as an effort to counter Western space superiority that has supported Ukraine in its conflict.",Disrupt Western space superiority and military communications via Starlink,,,,RUS,40,VERIFIED,MAKS23_NAFO,https://t.me/MAKS23_NAFO/77474
710692df-34c4-4ae3-ad8c-4a797fcb5186,2025-12-22 14:17:43,Gli invasori attaccano le unità militari a Dobropillya,Invaders Assault Military Units in Dobropillya,"Il 22 dicembre 2025, gli invasori hanno condotto un attacco tattico contro le unità militari nella direzione di Dobropillya. L'operazione ha coinvolto i marines delle brigate 40 e 155. Gli sforzi congiunti del 1° Corpo 'Azov' e SBS hanno portato alla distruzione di 24 veicoli blindati e diverse dozzine di veicoli moto/quadro.","On December 22, 2025, invaders conducted a tactical assault on military units in the Dobropillya direction. The operation involved marines from the 40th and 155th brigades. Joint efforts by the 1st Corps 'Azov' and SBS resulted in the destruction of 24 armored vehicles and several dozen moto/quadro vehicles.",Tactical assault on military units,Dobropillya,,,RUS,40,VERIFIED,MAKS23_NAFO,https://t.me/MAKS23_NAFO/77472
82b74b94-e226-4367-9ff4-0f6d1bfc2eaf,2025-12-22 14:12:00,Macron Blocca Piano di Prestito per l'Ucraina al Vertice UE,Macron Blocks Loan Plan for Ukraine at EU Summit,"Il presidente francese Emmanuel Macron ha svolto un ruolo fondamentale al vertice dell'UE del 22 dicembre 2025, bloccando la proposta della Germania di utilizzare beni russi congelati come garanzia per un prestito all'Ucraina. Invece, ha ottenuto supporto per un meccanismo di finanziamento alternativo, noto come 'Piano B', che prevede un sostegno diretto dal bilancio dell'UE tramite prestiti congiunti. Macron ha assicurato che l'Ungheria non avrebbe posto il veto a questo piano.","French President Emmanuel Macron played a pivotal role at the EU summit on December 22, 2025, by blocking Germany's proposal to use frozen Russian assets as collateral for a loan to Ukraine. Instead, he garnered support for an alternative financing mechanism, known as 'Plan B', which involves direct EU budget support through joint borrowing. Macron ensured that Hungary would not veto this plan.",Diplomatic maneuvering to secure EU funding for Ukraine,,,,UNK,40,VERIFIED,MAKS23_NAFO | noel_reports,https://t.me/MAKS23_NAFO/77470 | https://t.me/noel_reports/38876
558fb8a8-9c5c-4e18-8d68-f6d8b6c5626a,2025-12-22 13:06:03,Le Forze Ucraine Attaccano le Infrastrutture Militari Russe a Donetsk,Ukrainian Forces Attack Russian Military Infrastructure in Donetsk,"Lo Stato Maggiore conferma un attacco al terminal petrolifero 'Tamanneftegaz'. Le forze ucraine hanno colpito una base di barche fluviali della 92ª brigata russa con un missile. Inoltre, è stato distrutto un deposito di munizioni del reggimento di fucilieri motorizzati invasori, insieme a strutture per lo stoccaggio e il lancio di droni d'attacco nella regione di Donetsk.","The General Staff confirms an attack on the 'Tamanneftegaz' oil terminal. Ukrainian forces targeted a river boat base of the 92nd Russian brigade with a missile. Additionally, an ammunition depot of the invading motorized rifle regiment was destroyed, along with facilities for storing and launching strike drones in the Donetsk region.",Logistics disruption and military infrastructure degradation,Donetsk region,,,UKR,40,VERIFIED,MAKS23_NAFO,https://t.me/MAKS23_NAFO/77460
9f275cf8-077f-4295-9033-bedf9de58e80,2025-12-22 12:01:52,Ucraina Riceve Attrezzature per Centrale Elettrica dalla Lituania,Ukraine Receives Power Plant Equipment from Lithuania,"L'Ucraina ha ricevuto una centrale termica dalla Lituania tramite il Meccanismo di Protezione Civile dell'UE, secondo il Ministero dell'Energia. L'operazione, durata 11 mesi, ha coinvolto 149 spedizioni per un totale di 2.399 tonnellate, comprese 40 spedizioni sovradimensionate con trasformatori e statori pesanti di circa 172 tonnellate ciascuno. Questa attrezzatura aiuterà nelle riparazioni di emergenza in diverse regioni dell'Ucraina colpite dai danni causati dai bombardamenti russi.","Ukraine has received a thermal power plant from Lithuania via the EU Civil Protection Mechanism, according to the Ministry of Energy. The operation, lasting 11 months, involved 149 shipments totaling 2,399 tons, including 40 oversized loads with heavy transformers and stators of approximately 172 tons each. This equipment will aid in emergency repairs across various regions of Ukraine affected by damage from Russian strikes.",Infrastructure repair and support,,,,UNK,40,VERIFIED,MAKS23_NAFO,https://t.me/MAKS23_NAFO/77449
f1082bb9-6a97-4fe9-9143-5f4c5e2b0f7f,2025-12-22 20:10:58,Le Forze Russe Colpiscono le Posizioni Ucraine nella Regione di Odessa,Russian Forces Strike Ukrainian Positions in Odessa Region,"Il 22 dicembre 2025, le truppe russe hanno condotto una serie di attacchi contro obiettivi delle Forze Armate ucraine nella regione di Odessa e hanno colpito un treno nell'area di Korosten. Le formazioni ucraine hanno attaccato le infrastrutture di raffinazione del petrolio nel Krasnodar Krai utilizzando droni. Nella direzione di Burluk, le unità del Gruppo Settentrionale hanno espulso il nemico da Vilchi e hanno continuato la loro avanzata nella foresta di Tatar. Nella direzione di Konstantinov, i reparti d'assalto russi hanno gradualmente ampliato la loro zona di controllo attorno alla città omonima.","On December 22, 2025, Russian troops conducted a series of strikes against Ukrainian Armed Forces targets in the Odessa region and hit a train in the Korosten area. Ukrainian formations attacked oil refining infrastructure in Krasnodar Krai using drones. In the Burluk direction, units of the Northern Group pushed the enemy out of Vilchi and continued their advance in the Tatar forest. In the Konstantinov direction, Russian stormtroopers gradually expanded their control zone around the city of the same name.",Disrupting Ukrainian logistics and infrastructure while advancing territorial control.,"Odessa, Korosten, Krasnodar",,,RUS,40,VERIFIED,rybar,https://t.me/rybar/76184
22fb1671-0fc6-4e12-a5c6-db72e04d0083,2025-12-22 17:40:01,Le Forze Russe Espandono il Controllo Vicino a Konstantinovka,Russian Forces Expand Control Near Konstantinovka,"I combattimenti continuano vicino a Konstantinovka con battaglie posizionali in corso. Le unità russe si stanno accumulando ai margini della città, espandendo il loro controllo nell'area. Le segnalazioni di una breccia vicino a Verolyubovka rimangono non confermate. Nelle vicinanze di Predtechino, parte della tasca vicino alla città è stata ripulita. Le unità d'assalto russe stanno avanzando in città da Predtechino, operando a sud dell'autostrada N-32, che divide Konstantinovka.","Fighting continues near Konstantinovka with positional battles ongoing. Russian units are accumulating on the city's outskirts, expanding their control in the area. Reports of a breakthrough near Verolyubovka remain unconfirmed. In the vicinity of Predtechino, part of the pocket near the city has been cleared. Russian assault units are advancing in the city from Predtechino, operating south of the N-32 highway, which divides Konstantinovka.",Territorial Control,Konstantinovka,,,RUS,40,VERIFIED,rybar,https://t.me/rybar/76181
bc076bcd-ea5a-4f12-96b0-3c9b2a6eafd5,2025-12-22 13:34:52,I droni FPV distruggono un carro armato Abrams australiano vicino a Pokrovsk,FPV Drones Destroy Australian Abrams Tank Near Pokrovsk,"Il 22 dicembre 2025, i droni FPV del Centro Rubicon hanno preso di mira e distrutto un carro armato M1A1 Abrams appartenente alle Forze Armate ucraine vicino a Pokrovsk. Il carro armato è stato immobilizzato prima di essere colpito da una serie di attacchi aerei precisi. Questo incidente segna la prima distruzione confermata di un carro armato Abrams di origine australiana al fronte. Il modello di mimetizzazione ha identificato il carro armato come australiano, dopo il suo trasferimento in Ucraina.","On December 22, 2025, FPV drones from the Rubicon Center targeted and destroyed an M1A1 Abrams tank belonging to the Ukrainian Armed Forces near Pokrovsk. The tank was immobilized before being hit by a series of precise drone strikes. This incident marks the first confirmed destruction of an Australian-origin Abrams tank at the front. The camouflage pattern identified the tank as Australian, following its transfer to Ukraine.",Targeting and neutralizing high-value military assets to degrade enemy capabilities.,Krasnoarmiysk (Pokrovsk),,,RUS,40,VERIFIED,rybar,https://t.me/rybar/76178
1377aa10-8ec2-4475-9c7d-4682cf3c7876,2025-12-22 12:02:01,Le Forze Russe Consolidano il Controllo nell'Area di Vylcha,Russian Forces Consolidate Control in Vylcha Area,"Le unità militari russe hanno acquisito il controllo su Vylcha nella regione di confine di Kharkiv. Dopo la liberazione di Lyman, il Ministero della Difesa russo ha annunciato che il gruppo 'Sever' ha respinto le forze ucraine da Vylcha. Questa località era precedentemente significativa per la difesa ucraina vicino a Volchansk, fungendo da hub di rifornimento. I raid aerei russi hanno preso di mira sistematicamente le infrastrutture ucraine a Vylcha durante il conflitto.","Russian military units have gained control over Vylcha in the Kharkiv border region. Following the liberation of Lyman, the Russian Ministry of Defense announced that the 'Sever' group has pushed Ukrainian forces out of Vylcha. This location was previously significant for Ukrainian defense near Volchansk, serving as a supply hub. Russian airstrikes systematically targeted Ukrainian infrastructure in Vylcha during the conflict.",Logistics disruption and territorial consolidation,Vilcha,,,RUS,40,VERIFIED,rybar,https://t.me/rybar/76176
05216e20-ce58-4991-b5d9-7f5492a7a0ad,2025-12-22 12:41:17,Esplosioni segnalate nelle regioni di Sumy e Zhytomyr,Explosions Reported in Sumy and Zhytomyr Regions,"Tra il 21 e il 22 dicembre 2025, sono state segnalate più esplosioni nella regione di Sumy, specificamente a Khoten e Krasnopole. Inoltre, si è verificata un'esplosione nella regione di Zhytomyr. Gli incidenti hanno coinvolto l'uso di sistemi di artiglieria a razzo. Non sono stati forniti dettagli sui danni.","On December 21-22, 2025, multiple explosions were reported in the Sumy region, specifically in Khoten and Krasnopole. Additionally, an explosion occurred in the Zhytomyr region. The incidents involved the use of rocket artillery systems. No damage details have been provided.",Logistics disruption,Sumy region,,,RUS,40,VERIFIED,lost_armour,https://t.me/lost_armour/7521
44640832-7c01-4f6b-ad58-8638f4c6fa4a,2025-12-22 11:27:50,Il complesso ZALA elimina l'unità Bogdana in Zaporizhia,ZALA Complex Eliminates Bogdana Self-Propelled Gun in Zaporizhia,"A Zaporizhia, il complesso di ricognizione e attacco ZALA 'Lantset' del gruppo 'Vostok' ha distrutto un'unità di artiglieria semovente Bogdana ucraina. L'unità stava prendendo di mira posizioni vicino a Huliaipole quando è stata rilevata dagli operatori UAV ZALA Z-16 durante la ricognizione aerea. Dopo aver sparato, l'equipaggio della Bogdana ha tentato di spostarsi in un rifugio ma è stato monitorato continuamente. Lo ZALA Z-16 ha tracciato la ritirata dell'unità verso un'area boschiva, dove le coordinate sono state rapidamente trasmesse a munizioni in volo.","In Zaporizhia, the ZALA 'Lantset' reconnaissance-strike complex of the 'Vostok' group destroyed a Ukrainian Bogdana self-propelled artillery unit. The unit was targeting positions near Huliaipole when it was detected by ZALA Z-16 UAV operators during aerial reconnaissance. After firing, the Bogdana crew attempted to relocate to cover but was continuously monitored. The ZALA Z-16 tracked the unit's retreat to a forest area, where coordinates were quickly relayed to loitering munitions.",Counter-battery and fire suppression,Zaporizhzhia region,,,RUS,40,VERIFIED,lost_armour,https://t.me/lost_armour/7520
