Cluster_ID,Date,Title,Title_EN,Description,Description_EN,Type,Location_Name,Lat,Lon,Actor,Reliability,Verification_Status,Source_Names,Source_Links
4060a3bf-e0ef-4d63-b051-aecec7d57a13,2025-12-22 21:29:34,Mosca Evacua Diplomatici dal Venezuela,Moscow Evacuates Diplomats from Venezuela,"I rapporti indicano che Mosca ha iniziato a evacuare diplomatici e le loro famiglie dal Venezuela, presumibilmente a partire da venerdì scorso. Questa azione è collegata a preoccupazioni riguardo a una potenziale operazione militare statunitense, come suggerito da una fonte nell'intelligence europea. Il Ministero degli Esteri russo avrebbe una visione scettica delle prospettive di Maduro.","Reports indicate that Moscow has begun evacuating diplomats and their families from Venezuela, allegedly starting last Friday. This action is linked to concerns over a potential US military operation, as suggested by a source in European intelligence. The Russian Foreign Ministry reportedly holds a skeptical view of Maduro's prospects.",Preemptive evacuation in anticipation of potential US military operation.,Venezuela,,,RUS,40,VERIFIED,voenkorKotenok,https://t.me/voenkorKotenok/69610
b55f413d-a1e8-4fc9-9c86-7a76ccebab99,2025-12-22 19:11:37,Le forze ucraine colpiscono Dzerzhinsk nel Donbas,Ukrainian Forces Target Dzerzhinsk in Donbas,"Le forze ucraine hanno trasformato Dzerzhinsk in una posizione fortificata negli ultimi 11 anni, lanciando attacchi su Gorlovka. La distruzione strategica mirava a provocare risposte dalle forze avversarie. Dzerzhinsk è stato dichiarato parte della Russia il 7 febbraio 2025, con una distanza diretta di 20 km da Konstantinovka. Il conflitto in corso ha causato significative perdite e distruzione nella regione.","Ukrainian forces have reportedly transformed Dzerzhinsk into a fortified position over the past 11 years, launching attacks on Gorlovka. The strategic destruction aimed to provoke responses from opposing forces. Dzerzhinsk was declared part of Russia on February 7, 2025, with a direct distance of 20 km to Konstantinovka. The ongoing conflict has resulted in significant casualties and destruction in the region.",Historical narrative emphasizing Ukrainian actions and strategic destruction,Dzerzhinsk (Toretsk),,,UKR,40,VERIFIED,voenkorKotenok,https://t.me/voenkorKotenok/69606
aff251f6-f5b7-4be0-ad02-accfc169f300,2025-12-22 17:37:47,Droni Ucraini Attaccano Porto nella Regione di Kuban,Ukrainian Drones Attack Port in Kuban Region,"Le Forze Armate ucraine hanno lanciato attacchi con droni su un porto nel villaggio di Volna, situato nella regione di Kuban controllata dalla Russia. L'attacco ha interrotto la logistica e le infrastrutture nella zona. Non sono stati confermati immediatamente danni o vittime.","Ukrainian Armed Forces launched drone strikes on a port in the village of Volna, located in the Russian-controlled Kuban region. The attack disrupted logistics and infrastructure in the area. No immediate reports of damage or casualties have been confirmed.",Disrupting logistics or infrastructure in a Russian-controlled area.,Volna,,,UKR,40,VERIFIED,voenkorKotenok,https://t.me/voenkorKotenok/69604
2bc05ca4-bb0f-4234-a282-57f695a7105b,2025-12-22 17:10:20,M1A1 Abrams Ucraino Danno nella Direzione di Pokrovsk,Ukrainian M1A1 Abrams Damaged in Pokrovsk Direction,"Un carro armato M1A1 Abrams è stato danneggiato nella direzione di Pokrovsk. Il carro armato è identificato come uno dei 49 veicoli forniti all'Ucraina dall'Australia. La consegna è avvenuta in due fasi, con 37 carri arrivati a luglio e il resto a dicembre.","An M1A1 Abrams tank has been damaged in the Pokrovsk direction. The tank is identified as one of the 49 units supplied to Ukraine by Australia. The delivery occurred in two phases, with 37 tanks arriving in July and the remainder in December.",Degrading Ukrainian military capabilities,Pokrovskoye,,,RUS,40,VERIFIED,voenkorKotenok,https://t.me/voenkorKotenok/69603
14e2d656-746b-4774-8365-ce9edcbec74e,2025-12-22 16:12:18,Colpi russi interrompono la logistica nella regione di Odesa,Russian Strikes Disrupt Logistics in Odesa Region,"Nella regione di Odesa, i colpi di droni russi hanno preso di mira le strutture di Allseeds Black Sea nel porto di Yuzhny, danneggiando circa 30 camion. Questo attacco evidenzia l'interruzione in corso delle infrastrutture economiche e logistiche, fondamentali per le operazioni di Kyiv. Si prevede che i colpi aumenteranno i premi di rischio e la pressione sulle catene di approvvigionamento ucraine, influenzando sia la logistica finanziaria che militare.","In the Odesa region, Russian drone strikes targeted the Allseeds Black Sea facilities at the Yuzhny port, damaging around 30 cargo trucks. This attack highlights the ongoing disruption of economic and logistical infrastructure, which has been crucial for Kyiv's operations. The strikes are expected to increase risk premiums and pressure on Ukraine's supply chains, affecting both financial and military logistics.",Disruption of logistics and economic infrastructure to increase risk premiums and pressure Kyiv.,Одесская область,,,RUS,40,VERIFIED,voenkorKotenok,https://t.me/voenkorKotenok/69602
a611fdf3-fc97-4449-9b29-44108ffd76a7,2025-12-22 14:30:25,Attacco Interrompe Operazioni Ferroviarie nella Regione di Zhytomyr,Attack Disrupts Railway Operations in Zhytomyr Region,"Un treno ferroviario in viaggio da Kharkiv a Uzhhorod è stato colpito nella regione di Zhytomyr, fermando le operazioni su questo segmento. Ci sono preoccupazioni in alcune comunità online riguardo a un possibile aumento degli attacchi con droni nelle aree controllate da Kyiv nei prossimi giorni.","A railway train traveling from Kharkiv to Uzhhorod was targeted in the Zhytomyr region, halting operations on this segment. There are concerns in certain online communities about a potential increase in drone strikes on areas controlled by Kyiv in the coming days.",Disrupting logistics by targeting railway infrastructure,Zhytomyr,,,RUS,40,VERIFIED,voenkorKotenok,https://t.me/voenkorKotenok/69597
267b3ca8-0f02-4b55-94e0-e16452bc2c93,2025-12-22 12:09:00,Colpo di droni colpisce treno merci a Korosten,Drone Strike Hits Cargo Train in Korosten,"Il 22 dicembre 2025, un treno merci è stato colpito da droni nell'area di Korosten, nella regione di Zhytomyr, trasportando presumibilmente sistemi di difesa aerea per le Forze Armate ucraine. Le Ferrovie ucraine hanno confermato che un locomotore e diverse carrozze sono deragliati a causa dell'attacco.","On December 22, 2025, a cargo train was struck by drones in the Korosten area of Zhytomyr Oblast, reportedly transporting air defense systems for the Ukrainian Armed Forces. Ukrainian Railways confirmed that a locomotive and several cars derailed as a result of the strike.",Logistics disruption,Korosten,,,RUS,40,VERIFIED,voenkorKotenok,https://t.me/voenkorKotenok/69587
57632a20-2629-4413-916a-fd1e00514c42,2025-12-22 17:41:51,L'Ucraina Colpisce Infrastrutture Militari a Sebastopoli,Ukraine Targets Military Infrastructure in Sevastopol,"Il 22 dicembre 2025, le sirene antiaeree hanno suonato a Sebastopoli, Crimea, mentre le forze ucraine colpivano infrastrutture militari. Le autorità di occupazione hanno cercato di indirizzare i civili verso i rifugi in tutta la città nel contesto del conflitto in corso.","On December 22, 2025, air raid sirens sounded in Sevastopol, Crimea, as Ukrainian forces targeted military infrastructure. Occupation authorities worked to direct civilians to shelters throughout the city amid the ongoing conflict.",Targeting military infrastructure to degrade enemy capabilities,Sevastopol,,,UKR,40,VERIFIED,noel_reports,https://t.me/noel_reports/38895
8235a7eb-ed15-46f1-981f-27d621454559,2025-12-22 17:16:45,La Svezia testa il drone Kreuger 100 per l'Ucraina,Sweden Tests Kreuger 100 Drone for Ukraine,"La Difesa Aerea Nordica della Svezia testerà il drone intercettore Kreuger 100 quest'inverno. Il drone, progettato per prove operative contro i droni Shahed in Ucraina, è compatto e può essere lanciato da sistemi portatili. Raggiunge velocità di 354 km/h con un raggio di 3,2 km, privilegiando l'affordabilità e il dispiegamento di massa.","Sweden's Nordic Air Defense will test the Kreuger 100 interceptor drone this winter. The drone, designed for operational trials against Shahed drones in Ukraine, is compact and can be launched from handheld systems. It reaches speeds of 354 km/h with a range of 3.2 km, prioritizing affordability and mass deployment.",Testing and deployment of new military technology,Ukraine,,,UNK,40,VERIFIED,noel_reports,https://t.me/noel_reports/38893
4436b248-88bf-458a-baa3-3a68c4dbf850,2025-12-22 17:02:40,Attacco Droni Neutralizza Artiglieria Russa Vicino a Myrnohrad,Drone Strike Neutralizes Russian Artillery Near Myrnohrad,"Il 22 dicembre 2025, i piloti di droni della 79ª Brigata Avanzata hanno distrutto con successo un lanciatore di razzi BM-21 Grad russo vicino a Malynivka, a est di Myrnohrad. L'operazione è stata eseguita sulla base di informazioni tempestive, prevenendo un potenziale attacco da parte dell'unità di artiglieria.","On December 22, 2025, drone pilots from the 79th Air Assault Brigade successfully destroyed a Russian BM-21 Grad rocket launcher near Malynivka, east of Myrnohrad. The operation was executed based on timely intelligence, preventing a potential strike by the artillery unit.",Preventative strike to neutralize Russian artillery unit,Myrnohrad,,,UKR,40,VERIFIED,noel_reports,https://t.me/noel_reports/38892
7d930777-5dd1-470a-893d-181a8a20e39b,2025-12-22 16:39:26,Ucraina si prepara a possibile attacco russo prima delle festività,Ukraine Prepares for Potential Russian Strike Ahead of Holidays,"Il presidente ucraino Zelensky avverte di un possibile attacco su larga scala da parte della Russia nei prossimi giorni. I rapporti indicano un'attività insolita nell'aviazione strategica russa, con preparativi per un attacco significativo di droni e missili, potenzialmente coinvolgente fino a 800 droni, previsto tra il 25 e il 26 dicembre.","Ukrainian President Zelensky warns of a possible large-scale strike by Russia in the coming days. Reports indicate unusual activity in Russian strategic aviation, with preparations for a significant drone and missile attack, potentially involving up to 800 drones, expected between December 25 and 26.",Potential large-scale kinetic strike to degrade Ukrainian morale and infrastructure ahead of holidays.,,,,RUS,40,VERIFIED,noel_reports,https://t.me/noel_reports/38891
b21b6210-f361-45eb-a832-7510770ddd7f,2025-12-22 16:05:49,Ucraina Respinge Assalto Russo all'Asse di Dobropillia,Ukraine Repels Russian Assault at Dobropillia Axis,"Il 22 dicembre 2025, il 1° Corpo Azov dell'Ucraina e le unità di supporto hanno respinto con successo un assalto russo all'asse di Dobropillia in meno di due ore. L'attacco ha portato alla distruzione di 24 veicoli blindati, insieme a numerosi motocicli, quad e cavalli utilizzati nell'operazione vicino a Razine.","On December 22, 2025, Ukraine's 1st Azov Corps and supporting units successfully repelled a Russian assault on the Dobropillia axis in under two hours. The attack resulted in the destruction of 24 armored vehicles, along with numerous bikes, quads, and horses used in the operation near Razine.",Repelling an assault to maintain territorial control,Razine,,,RUS,40,VERIFIED,noel_reports,https://t.me/noel_reports/38885
dc42ad68-add6-4d59-ad3d-15e2dd71d580,2025-12-22 15:59:10,Drone Ucraino Mantiene Posizione nella Zona di Conflitto,Ukrainian Drone Holds Position in Conflict Zone,"Per 45 giorni, un drone terrestre della 3ª Brigata d'Assalto ucraina ha mantenuto una posizione difensiva, sopprimendo i movimenti nemici con il fuoco di mitragliatrice. Operato da remoto, il DevDroid TW 12.7 ha messo in sicurezza l'area senza perdite.","For 45 days, a ground drone from Ukraine’s 3rd Assault Brigade maintained a defensive position, suppressing enemy movements with machine gun fire. Operated remotely, the DevDroid TW 12.7 secured the area without any losses.",Suppression and Position Holding,,,,UKR,40,VERIFIED,noel_reports,https://t.me/noel_reports/38884
eff70b3b-97b9-4d47-978b-d12fc7dff497,2025-12-22 15:54:12,Zelensky Risponde agli Attacchi Russi in Ucraina,Zelensky Responds to Russian Attacks in Ukraine,"Il presidente ucraino Volodymyr Zelensky ha dichiarato che se la Russia non si impegna seriamente nei negoziati e continua la guerra, l'Ucraina risponderà in modo decisivo. Ha notato un aumento degli attacchi russi insieme alle loro perdite. L'Ucraina sta potenziando la difesa aerea, la copertura del fronte e apportando cambiamenti al comando.","Ukrainian President Volodymyr Zelensky stated that if Russia does not engage seriously in negotiations and continues the war, Ukraine will respond decisively. He noted an increase in Russian attacks alongside their losses. Ukraine is enhancing air defense, frontline coverage, and making command changes.",Deterrence and maintaining military pressure on Russia.,,,,UNK,40,VERIFIED,noel_reports,https://t.me/noel_reports/38882
426b2177-d742-478f-b7a8-915c357f76da,2025-12-22 15:24:29,Le Forze Ucraine Fermano l'Assalto Russo Vicino a Kostyantynivka,Ukrainian Forces Halt Russian Assault Near Kostyantynivka,"Il 22 dicembre 2025, la 93ª Brigata Meccanizzata dell'Ucraina e le Unità di Guardia di Frontiera Phoenix hanno utilizzato droni FPV per fermare un assalto meccanizzato russo sull'asse di Kostyantynivka. L'operazione ha portato alla distruzione di tre veicoli blindati, incluso un BTR.","On December 22, 2025, Ukraine’s 93rd Mechanized Brigade and Phoenix Border Guard Units utilized FPV drones to thwart a Russian mechanized assault on the Kostyantynivka axis. The operation resulted in the destruction of three armored vehicles, including a BTR.",Attempted mechanized assault halted by drone strikes,Kostyantynivka,,,RUS,40,VERIFIED,noel_reports,https://t.me/noel_reports/38881
1b10d04d-09ad-4db7-9770-77f889189545,2025-12-22 14:23:15,"Le truppe russe rapiscono civili a Hrabovske, Ucraina","Russian Troops Abduct Civilians in Hrabovske, Ukraine","Le truppe russe hanno rapito circa 50 civili, principalmente anziani, dal villaggio di Hrabovske nella regione di Sumy. I rapimenti sono avvenuti dopo che i civili, che avevano precedentemente rifiutato l'evacuazione, sono stati radunati all'interno di una chiesa locale. Il Garante dei diritti umani ucraino ha confermato le detenzioni, affermando che i civili sono stati trattenuti senza comunicazione o condizioni di base prima della loro deportazione il 20 dicembre. Il Ministro degli Esteri ucraino Andrii Sybiha ha etichettato l'atto come terrorismo.","Russian troops abducted approximately 50 civilians, primarily elderly, from Hrabovske village in the Sumy region. The abductions occurred after the civilians, who had previously refused evacuation, were gathered inside a local church. Ukraine's Ombudsman confirmed the detentions, stating that the civilians were held without communication or basic conditions before their deportation on December 20. Ukrainian Foreign Minister Andrii Sybiha labeled the act as terrorism.",Forced deportation of civilians as a tactic of intimidation and control,Hrabovske,,,RUS,40,VERIFIED,noel_reports,https://t.me/noel_reports/38879
00faf3c5-ed43-40a5-9b61-5f46209575fe,2025-12-22 14:11:58,Ucraini infiltrano la base aerea russa a Lipetsk,Ukrainians Infiltrate Russian Airfield in Lipetsk,"Le forze ucraine hanno rilasciato un video che mostra individui sconosciuti infiltrarsi nella base aerea di Lipetsk-2, entrare nelle cabine di pilotaggio e appiccare fuoco agli aerei Su-27 e Su-30. I milblogger russi hanno espresso frustrazione, citando lacune nella sicurezza dovute al trasferimento del personale. Alcuni commentatori suggeriscono che la Russia dovrebbe ritirare le truppe da dispiegamenti inefficaci per proteggere meglio le basi chiave.","Ukrainian forces released footage showing unknown individuals infiltrating Lipetsk-2 airfield, entering fighter cockpits, and setting fire to Su-27 and Su-30 aircraft. Russian milbloggers expressed frustration, citing security lapses due to personnel reassignment. Some commentators suggest Russia should withdraw troops from ineffective deployments to better protect key bases.",Disrupting Russian air capabilities and undermining morale.,Lipetsk-2,,,UA,15,VERIFIED,noel_reports,https://t.me/noel_reports/38878
859a17f0-e6be-477e-aef1-57b719d6fd22,2025-12-22 14:07:20,Le Forze Ucraine Difendono Dobropillia Contro l'Assalto Russo,Ukrainian Forces Defend Dobropillia Against Russian Assault,"Il 22 dicembre 2025, il Comandante dei Sistemi Senza Equipaggio Robert Brovdi ha riportato un significativo successo difensivo sull'asse di Dobropillia. Le forze russe hanno lanciato un attacco utilizzando veicoli meccanizzati e leggeri. Il 1° Corpo Azov ucraino, insieme ad altre unità, ha distrutto con successo 24 veicoli blindati e numerosi motocicli e quad in circa 100 minuti. Inoltre, sono stati persi dei cavalli durante l'ingaggio.","On December 22, 2025, Unmanned Systems Commander Robert Brovdi reported a significant defensive success on the Dobropillia axis. Russian forces launched an attack using mechanized and light vehicles. The Ukrainian 1st Azov Corps, along with other units, successfully destroyed 24 armored vehicles and numerous motorcycles and quads within approximately 100 minutes. Additionally, horses were lost during the engagement.",Defensive engagement with mechanized and light vehicle assault,Dobropillia,,,RUS,40,VERIFIED,noel_reports,https://t.me/noel_reports/38877
1d7aad6f-df8b-4748-b44c-f05bb5de890b,2025-12-22 14:01:10,Gli omicidi mirati colpiscono generali russi a Mosca,Assassination Targets Russian Generals in Moscow,"Nel 2025, tre tenenti generali russi sono stati uccisi in attentati con autobombe a Mosca. Le vittime includevano Ihor Kyrylov, Yaroslav Moskalyk e Fanil Sarvarov, tutti vicini al presidente Putin e da lui nominati. Gli incidenti si sono verificati nel dicembre 2024, aprile 2025 e dicembre 2025, evidenziando una significativa preoccupazione per la sicurezza degli alti ufficiali militari nella regione.","In 2025, three Russian lieutenant generals were killed in car bombings in Moscow. The victims included Ihor Kyrylov, Yaroslav Moskalyk, and Fanil Sarvarov, all of whom were close to President Putin and appointed by him. The incidents occurred in December 2024, April 2025, and December 2025, highlighting a significant security concern for high-ranking military officials in the region.",Targeted assassination of high-ranking military officials,Moscow,,,UNK,40,VERIFIED,noel_reports,https://t.me/noel_reports/38875
d946cc40-0b0b-4d63-a4cb-29bfaf463039,2025-12-22 13:25:59,Attacchi ucraini disturbano terminal petrolifero in Russia,Ukrainian Strikes Disrupt Oil Terminal in Russia,"L'intelligence militare ucraina ha colpito il terminal petrolifero Tamanneftegaz nel Krai di Krasnodar, Russia, utilizzando droni d'attacco a lungo raggio. L'attacco ha danneggiato infrastrutture critiche, tra cui attrezzature di carico e strutture portuali, provocando un grande incendio. Tamanneftegaz è un importante hub petrolifero nella regione del Mar Nero, con una capacità di stoccaggio superiore a 1 milione di m³.","Ukrainian military intelligence targeted the Tamanneftegaz oil terminal in Krasnodar Krai, Russia, using long-range strike drones. The attack damaged critical infrastructure, including loading equipment and port facilities, resulting in a large-scale fire. Tamanneftegaz is a significant oil hub in the Black Sea region, with a storage capacity exceeding 1 million m³.",Disrupting logistics and energy infrastructure in the Black Sea region.,Krasnodar Krai,,,UKR,40,VERIFIED,noel_reports,https://t.me/noel_reports/38873
a8c9bebb-f272-4c97-b1df-701b627885ba,2025-12-22 13:15:29,L'Ucraina colpisce obiettivi militari russi in Crimea,Ukraine Strikes Russian Military Targets in Crimea,"Il personale generale ucraino ha riportato attacchi notturni riusciti su più obiettivi militari russi. Il terminal petrolifero 'Tamanneftegaz' nel Krasnodar Krai è stato colpito, danneggiando un oleodotto, due moli e almeno due navi, causando un incendio su oltre 1.000 m². Un missile ha colpito anche la base della 92ª brigata russa a Yelynovka, Crimea occupata. A Donetsk occupata, un deposito di munizioni e siti di lancio di droni sono stati distrutti.","Ukraine's General Staff reported successful overnight strikes on multiple Russian military targets. The 'Tamanneftegaz' oil terminal in Krasnodar Krai was hit, damaging a pipeline, two piers, and at least two vessels, causing a fire over 1,000 m². A missile also struck the base of Russia's 92nd brigade in occupied Yelynovka, Crimea. In occupied Donetsk, an ammo depot and drone launch sites were destroyed.",Disruption of Russian military logistics and infrastructure,"Krasnodar Krai, Yelynovka, Crimea, Donetsk",,,UKR,40,VERIFIED,noel_reports,https://t.me/noel_reports/38872
b95455fd-af77-4f45-9818-24e356509ce0,2025-12-22 13:12:02,L'Ucraina Colpisce il Polo Petrolifero Russo in Krasnodar Krai,Ukraine Strikes Russian Oil Hub in Krasnodar Krai,"Le Forze di Sistema Senza Equipaggio dell'Ucraina hanno confermato un attacco al polo petrolifero Tamanneftegaz in Krasnodar Krai. L'attacco ha danneggiato un oleodotto, due banchine e due navi, accendendo incendi su un'area di 1.000 metri quadrati.","Ukraine’s Unmanned System Forces confirmed a strike on the Tamanneftegaz oil export hub in Krasnodar Krai. The attack damaged a pipeline, two berths, and two ships, igniting fires over an area of 1,000 square meters.",Disruption of Russian oil export capabilities,Krasnodar Krai,,,UKR,40,VERIFIED,noel_reports,https://t.me/noel_reports/38871
71c06713-0e1e-458a-9a9d-8ce03f0c638e,2025-12-22 11:13:58,Il 425° Reggimento d'Assalto Respinge Attacco Vicino a Pokrovsk,425th Assault Regiment Repels Attack Near Pokrovsk,"Il 20 dicembre 2025, il 425° Reggimento d'Assalto Separato “Skelya” ha respinto con successo un attacco russo alle periferie nord-occidentali di Pokrovsk. Il reggimento ha anche assicurato nuove posizioni durante l'operazione.","On December 20, 2025, the 425th Separate Assault Regiment “Skelya” successfully repelled a Russian assault on the northwestern outskirts of Pokrovsk. The regiment also secured new positions during the operation.",Repelling assault and securing new positions,Pokrovsk,,,RUS,40,VERIFIED,noel_reports,https://t.me/noel_reports/38865
10b25f67-2a96-48f2-8a36-de2be141c196,2025-12-23 02:53:59,Le Forze Ucraine Colpiscono un Drone Russo Vicino al Dnipro,Ukrainian Forces Target Russian Drone Near Dnipro,I soldati ucraini preparano munizioni mentre monitorano un drone russo vicino al fiume Dnipro. Utilizzano un dispositivo per intercettare i segnali video dei droni nemici. Un drone russo si avvicina alla loro posizione ma viene disturbato dai disturbatori ucraini. Si sente un'esplosione in lontananza mentre il drone si schianta.,Ukrainian soldiers prepare ammunition while monitoring a Russian drone near the Dnipro River. They utilize a device to intercept video signals from enemy drones. A Russian drone approaches their position but is jammed by Ukrainian disruptors. An explosion is heard in the distance as the drone crashes.,Targeted strike on enemy military position to degrade operational capabilities.,Dnipro,,,UKR,40,VERIFIED,parabellumcommunity,https://t.me/parabellumcommunity/335793
2ff71006-665d-4a70-b4ae-51bf344b552a,2025-12-23 02:48:52,Squadra di Droni Ucraina Effettua Ricognizione a Kherson,Ukrainian Drone Team Conducts Reconnaissance in Kherson,"Una piccola unità di droni ucraini di quattro persone opera da un edificio parzialmente in rovina a Kherson, Ucraina. Questa squadra, composta da un comandante, un pilota, un navigatore e un tecnico esplosivo, è impegnata in attività di ricognizione e supporto al combattimento. La loro presenza evidenzia le difficoltà affrontate dai soldati in prima linea, poiché i progressi sono difficili senza essere rilevati. L'uso di droni economici sta trasformando le dinamiche del combattimento nella regione.","A small Ukrainian drone unit of four operates from a partially ruined building in Kherson, Ukraine. This team, consisting of a commander, pilot, navigator, and explosive technician, is engaged in reconnaissance and combat support. Their presence highlights the challenges faced by soldiers on the front lines, as advancements are difficult without being detected. The use of affordable drones is transforming combat dynamics in the region.",Reconnaissance and combat support using drones and explosives,Kherson,,,UKR,40,VERIFIED,parabellumcommunity,https://t.me/parabellumcommunity/335789
